玩了半天就出来了，开车进去要50元，一点不划算，一直都在爬山，车停下来，爬上去还要再下来开车。而且景点有点乱，标识不清。性价比不高，反正下次不会去了。,差评
临时决定去的，下午一点到，周围都没东西吃，餐馆都关门了，最后吃了泡面，，，，景区一般般，，进去就是都是台阶一路除了竹子都没什么可看，还不如景区外面的湖的风景，爬了一半坐车上山，山上就是个道观，，，没做好攻略，一家人都不信道佛的，所以比较失望。从道观看风景还不错。开观光车的那个人，冷着一张脸，一路疯狂开下山，上车的时候明明我们排在前面，后面的人都争座位，最后给我们一孩子两个大人的位置都是靠边不在一起的，而且空间位置不大，又拿着衣服什么的抱不了孩子，所以他一个人坐在我前排，孩子4岁，没有防护，一路猛开，，我很担心他，司机开到一半还拉人，问还有一个位置谁上，我们老妈又位置啊，他竟然让我把孩子抱一下，我快气**了，虽说孩子不收费是不给座，可有必要这样吗？周围人都说不要等了，现在很少一个人来玩的，司机才作罢又一路猛开，完全不顾及我家孩子，所以还是别坐这种车了，还不如坐大车，这种塑料膜挡着味道也很难闻，也看不清外面。还不安全。司机自己收钱，还不给票，下了车后又有人来收钱，怪不得一路开得像奔丧，想多跑几趟自己贪啊！很少写那么长，反正不会去第二次的地方。,差评
购买的山车，拿票的咨询过观光车可以无限次乘坐？但是坐车下山后，收车票的阿姨就把做观光车票没收了，说只能坐一次，再要坐上山就要出钱，对此非常不满,差评
看过评论，说的在同程买的票，过去验票不好弄，我确实体验到了，进口，保安说要去办公室验票，然后又去窗口，网络的订票，在窗口说不用在这里，然后帮忙扫了二维码，说可以，再去入口，还是要去办公室，连续扫码多次不成功，重新赖个人，要报号码，然后写上，出门去了，等着，过了一会，对讲机说，可以进入了！哎！！真累啊！去过后，，感觉不值，很多人都不是买票进入的！,差评
过年期间开车过去，道路两边停满了车，只能开车进去，山上停车费50元，比门票还贵，可见有多坑人。上坡还好饶着上去，而下山的路特别陡，还有好多急拐弯，新手开车怕晚了下坡不安全，什么都没玩，只能赶紧开车下去，所以买了两张门票基本什么都没玩到，冬天山上风景也不怎么样，觉得是最坑人的一次爬山。,差评
超级差劲！取票很方便，关键景区根本不在一个地方。先进的穹窿山景区。转完后就在景区里面找万鸟园，**活找不到。最后找到孙武文化园，卖票的说只能穿过文化园才能去万鸟园，否则就要回到景区门口。只能再买文化园的票进去，最后发现出了文化园还要走15分钟路。最后**的。万鸟园离穹窿山景区的停车场要走半小时路，草一天把老子累的。真坑。根就不是在同一个景区里面。。多走很多冤枉路。,差评
建议大家别来问题如下1、景区里面为山路带了宝宝根本寸步难行2、管理非常混乱景区标示不清在望湖园吃了饭出来看到标志说孙武园步行20分钟结果走到了2号停车场就没有路了一问才知道都是被标志坑了才走进来只好等观光车很多人窝在那边等车只有一个工作人员在那调度又说不用排队每次车来都是靠抢的上车等了5辆车以后还碰到一群宜信财富的人一大家子车子来了一拥而上不说一点素质都没有关键我还抱着孩子被他们家老头打了一下原因是因为我妈先上了车想把我手中的孩子接上车找他理论还说你们去投诉景区的确在外地人面前苏州的景区管理这么烂真觉得丢人这次出行相当失败买了三张门票居然就上山吃了顿饭还莫名其妙被宜信财富的人气着了那么大年纪了居然打一个孩子才18个月大的孩子关键他自己还带着一个孩子对了理论的时候工作人员呢？反正没人管,差评
景点还可以，保安素质太差，苏州也是大城市，希望可以招一些有文化的保安，反正太破坏自己城市的形象。,差评
不咋地！没啥看的，停车场没位,差评
在同程上定的票挺便宜的也方便，我要说的是景区一点都不值这个价钱，来了都后悔,差评
人多，杂乱，没处停车，山顶的素面还比较良心价。80元不值，下次不会来,差评
景色还行，管理差劲，就是因为本人手机遗漏在售票窗口了，急忙出了大门，就再也不让进了，给他们出示了当天的票据，同时在里面的家人都现身还是不行，硬性的又让重新买了一张票才让进，还叫嚣票据一次有效，问题是你门票又没有这样的描述，而且这种事要特事特办的，一点没有人情味，**要钱不讲道理，这样的风景就给你们这种管理人员给糟蹋了，作为苏州人为你们这种因为感到羞耻。03年来这儿玩的时候，民风纯朴，门票还便宜，现在呢？门票翻了八倍，买了门票进去还这个园要钱，那个园要钱，看到一个好一点的风景，才想走下去，别人就提醒我们下面的风景是要钱的，再结合我的亲身经历就是目光短浅，唯利是图，怪不得我身边的苏州人都是情愿去上方山，也不去穹隆山，原因出在这里。强烈建议换管理人员，否则只有两个字“糟蹋”！,差评
严重不爽中，1月9号去的，1月8号在同程订的穹窿山、万鸟园、孙武文化园套票，135一张，结果到了景点才知道这三个景点的套票现场卖120一张，可是已经支付了，有手续费不想退了，但心情受到了影响，不爽,差评
不太喜欢这里！景点少！还有些地方都有禁止游客入内，你说说我们花钱来这玩，有地方还不给进！我们花的钱是白花的呀,差评
景区周边车位较少，不建议自驾前往哦差劲，景区里面路线指示标志不清楚，很多人迷路。景区里很多都不让参观。以后免费都不会进第两次。差,差评
穹窿山是苏州最高的山，抱着很大的兴趣去游玩，没想到却是所有旅行中感觉最差的一次，主要问题是硕大的一个景区没有完整的指示系统，相关道路规划也很成问题。其次是车行道很窄，会车处没有明显的提示（箭头、路标、反光镜等等），孙武苑等景点没有很好的介绍和工作人员在现场。新建的上真观各路神仙、神兽造型怪异、施工工艺都很粗糙，制造厂家的联系方式硬生生的钉在雕塑上，很扎眼。不仅没有对道家文化进行很好的尊重与发扬，而且毁坏了整个景区的档次和品位。建议参照无锡灵山、常州天目湖等景点，进行细心系统的规划和管理，不要毁了这一方钟灵俊秀之地。,差评
我在网上订的是联票，我以为是万鸟园和孙武文化园都是在穹窿山里面的，谁知检票时才被告知万鸟园和孙武文化园在别的地方，完全是三个不同的景点，网上却沒有告知这一点。后来，玩穹窿山时，发现竟然全是爬山，累得半**，根本沒有什么看头，沒有任何特色，全是山树草之类的，这在任何地方都看得到，何必要老远，花这么贵的钱来买苦头吃。更糟糕的是，上山后，想坐车下山，却坐不到车。每个站点上都排着长得吓**人的队伍，车却很少，每辆又坐一点点人。自己走下山吧，又远得不得了，据说起码要走一个多小时。沒办法，我们只能等，等得心都要**了。就这样，时间被耽误了，再匆匆忙忙赶去万鸟园，晃了一下就只得马上走。再赶到孙武文化园时，都马上要关大门了，里面的那些景点房子全关门了。真伤心，135一张的门票，就这么样的旅游，完全是**。穹窿山还5a级，2a都不够格的，还不如万鸟园和孙武文化园。穹窿山沒有任何看头，建议大家不要去了，门口架式很好，里面啥都沒有，金玉其外，败絮其中。就爬爬山在哪都行，沒必要花那么贵的门票来这。很多来这的游客都是被广告忽悠来的，来过后直呼上当，真沒任何看头，却贵得要**。,差评
首先，刷码入园，没有换票，导致没有地图可以看。上山的路有点杂乱，尤其是道路标注模糊不清，看都看不懂！本以为就我一个人有这样的困惑，结果发现10个人有9个人要问咨询处的大爷孙武苑怎么走？这说明什么？说明景区的标示做的一塌糊涂，没有上下山路线标注，简直了！！！到了道观那里99%的人就迷路了！景区可以去那里随机采访几个人问问，看看你们的标示牌有没有人能看懂？从北门进，到了南门出来，孙武文化园就是个儿童游乐场，没其他好看的。本来到了南门我都打算打车回北门拿车了，最让人欣慰的是有免费大巴车可以去北门(但是路边也得标注一下吧，不问保安谁知道啊！！！标示牌那么难搞么？？？)一天下来，尽**绕路了5a你配不上！,差评
真的不值得啊，景色很一般，乾隆御道和一般有竹林的公园没什么区别啊，山中小溪都是干的，同样是夏天去年去的天目湖和杭州的山沟沟，溪水都给我们很好的体验，观光车说是几个停车点等打个电话就会来，可是就我们在6号点时他们不肯来要我们走到上真观那个点才接，苏州那天38度啊，又是1点啊，6号点那里都是无遮挡的山路走的差点中暑，幸亏中途遇到好心人载了一程，印象就更差了。唯一要赞的是孙武苑那家饭店，手艺不错性价比极高，老板娘推荐我们夏天吃鹅，那个汤真心鲜美肉质煮到正好，小孩吃了好多块,差评
真的不值得啊，景色很一般，乾隆御道和一般有竹林的公园没什么区别啊，山中小溪都是干的，同样是夏天去年去的天目湖和杭州的山沟沟，溪水都给我们很好的体验，观光车说是几个停车点等打个电话就会来，可是就我们在6号点时他们不肯来要我们走到上真观那个点才接，苏州那天38度啊，又是1点啊，6号点那里都是无遮挡的山路走的差点中暑，幸亏中途遇到好心人载了一程，印象就更差了。唯一要赞的是孙武苑那家饭店，手艺不错性价比极高，老板娘推荐我们夏天吃鹅，那个汤真心鲜美肉质煮到正好，小孩吃了好多块,差评
去之前网上看过烧烤园的收费，2013-11-24的帖子有写10块钱一个小时，押金100；我们是7个大人（其中只有2个男的），4个小孩（吃的都是另外带的，没吃烤的），租了2个炉子（圆的炉子，炭不多），给了老板200块钱，我们就开始烤了，烤了没多久就发现炭火已经不行了，都发白了，这时我们都还没吃饱，就说去加个炭，结果，老板说加一份炭要30块钱，那也只能加了呗，总不能饿着肚子回来吧，郁闷的是加的炭也是这样，烤了三炉就又是白的了，无语啊，之前没吃饱的，也吃不多了，就说不烤了，就去结账，结果老板来了一句，就是100块钱一个炉子，不是押金......................后来在边上说话的时候，就问了工作人员，一直这么贵吗？人家说不是，就今天搞活动，才这么贵的。再问平时多少钱的时候，人家就不肯告诉我们了。,差评
去之前网上看过烧烤园的收费，2013-11-24的帖子有写10块钱一个小时，押金100；我们是7个大人（其中只有2个男的），4个小孩（吃的都是另外带的，没吃烤的），租了2个炉子（圆的炉子，炭不多），给了老板200块钱，我们就开始烤了，烤了没多久就发现炭火已经不行了，都发白了，这时我们都还没吃饱，就说去加个炭，结果，老板说加一份炭要30块钱，那也只能加了呗，总不能饿着肚子回来吧，郁闷的是加的炭也是这样，烤了三炉就又是白的了，无语啊，之前没吃饱的，也吃不多了，就说不烤了，就去结账，结果老板来了一句，就是100块钱一个炉子，不是押金......................后来在边上说话的时候，就问了工作人员，一直这么贵吗？人家说不是，就今天搞活动，才这么贵的。再问平时多少钱的时候，人家就不肯告诉我们了。,差评
大家爬爬山什么的就可以了，但是到了山顶有很多殿，进入拜拜就可以了，千万别跟着那些道士让他带你上二楼给你算卦，一开始会给你免费讲解，然后让你求个签，再让你去解签，说10元钱，等你解签完就会让你在一本本子上写上你的名字，然后就会让你付钱了，还是付两次，会说写个两个399元，两个699元，两个999元随你！**，讲解两分钟比抢银行还快！我反正是给了不少钱才脱身！！！打着自愿的旗号，我想问下这是自愿？？？劝大家千万别再上当了！我觉得景区应该自身也管管，这种东西本来就是心诚则灵，别搞得那么商业化了！,差评
去之前网上看过烧烤园的收费，2013-11-24的帖子有写10块钱一个小时，押金100；我们是7个大人（其中只有2个男的），4个小孩（吃的都是另外带的，没吃烤的），租了2个炉子（圆的炉子，炭不多），给了老板200块钱，我们就开始烤了，烤了没多久就发现炭火已经不行了，都发白了，这时我们都还没吃饱，就说去加个炭，结果，老板说加一份炭要30块钱，那也只能加了呗，总不能饿着肚子回来吧，郁闷的是加的炭也是这样，烤了三炉就又是白的了，无语啊，之前没吃饱的，也吃不多了，就说不烤了，就去结账，结果老板来了一句，就是100块钱一个炉子，不是押金......................后来在边上说话的时候，就问了工作人员，一直这么贵吗？人家说不是，就今天搞活动，才这么贵的。再问平时多少钱的时候，人家就不肯告诉我们了。,差评
去之前网上看过烧烤园的收费，2013-11-24的帖子有写10块钱一个小时，押金100；我们是7个大人（其中只有2个男的），4个小孩（吃的都是另外带的，没吃烤的），租了2个炉子（圆的炉子，炭不多），给了老板200块钱，我们就开始烤了，烤了没多久就发现炭火已经不行了，都发白了，这时我们都还没吃饱，就说去加个炭，结果，老板说加一份炭要30块钱，那也只能加了呗，总不能饿着肚子回来吧，郁闷的是加的炭也是这样，烤了三炉就又是白的了，无语啊，之前没吃饱的，也吃不多了，就说不烤了，就去结账，结果老板来了一句，就是100块钱一个炉子，不是押金......................后来在边上说话的时候，就问了工作人员，一直这么贵吗？人家说不是，就今天搞活动，才这么贵的。再问平时多少钱的时候，人家就不肯告诉我们了。,差评
名气是很大，所以珍藏着这一景点一直未去，这次趁中秋放假，想仔细游玩一下。有些失望，景点导游图，不准确，勾画的非常随意，容易引起游客的误解，有些景点又不能上去，如：吴中之巅，遗憾！从孙武苑有路径可以到望湖园，若走，有门说你是出景区了，所以只好原道返回，经孙武苑-上真观，再到。其实，望湖园与上真观是紧邻的，但是导游图上标示是距离较远，真是坑人啊......，枉走了好多路，做了好多无用功。,差评
去之前网上看过烧烤园的收费，2013-11-24的帖子有写10块钱一个小时，押金100；我们是7个大人（其中只有2个男的），4个小孩（吃的都是另外带的，没吃烤的），租了2个炉子（圆的炉子，炭不多），给了老板200块钱，我们就开始烤了，烤了没多久就发现炭火已经不行了，都发白了，这时我们都还没吃饱，就说去加个炭，结果，老板说加一份炭要30块钱，那也只能加了呗，总不能饿着肚子回来吧，郁闷的是加的炭也是这样，烤了三炉就又是白的了，无语啊，之前没吃饱的，也吃不多了，就说不烤了，就去结账，结果老板来了一句，就是100块钱一个炉子，不是押金......................后来在边上说话的时候，就问了工作人员，一直这么贵吗？人家说不是，就今天搞活动，才这么贵的。再问平时多少钱的时候，人家就不肯告诉我们了。,差评
大家不要被骗了，上去后汽车还要交交通费50元不合理的收费。我要投诉他们，景区工作人员粗鲁无理，打人还不承认不要脸的态度，记忆深刻,差评
去之前网上看过烧烤园的收费，2013-11-24的帖子有写10块钱一个小时，押金100；我们是7个大人（其中只有2个男的），4个小孩（吃的都是另外带的，没吃烤的），租了2个炉子（圆的炉子，炭不多），给了老板200块钱，我们就开始烤了，烤了没多久就发现炭火已经不行了，都发白了，这时我们都还没吃饱，就说去加个炭，结果，老板说加一份炭要30块钱，那也只能加了呗，总不能饿着肚子回来吧，郁闷的是加的炭也是这样，烤了三炉就又是白的了，无语啊，之前没吃饱的，也吃不多了，就说不烤了，就去结账，结果老板来了一句，就是100块钱一个炉子，不是押金......................后来在边上说话的时候，就问了工作人员，一直这么贵吗？人家说不是，就今天搞活动，才这么贵的。再问平时多少钱的时候，人家就不肯告诉我们了。,差评
去之前网上看过烧烤园的收费，2013-11-24的帖子有写10块钱一个小时，押金100；我们是7个大人（其中只有2个男的），4个小孩（吃的都是另外带的，没吃烤的），租了2个炉子（圆的炉子，炭不多），给了老板200块钱，我们就开始烤了，烤了没多久就发现炭火已经不行了，都发白了，这时我们都还没吃饱，就说去加个炭，结果，老板说加一份炭要30块钱，那也只能加了呗，总不能饿着肚子回来吧，郁闷的是加的炭也是这样，烤了三炉就又是白的了，无语啊，之前没吃饱的，也吃不多了，就说不烤了，就去结账，结果老板来了一句，就是100块钱一个炉子，不是押金......................后来在边上说话的时候，就问了工作人员，一直这么贵吗？人家说不是，就今天搞活动，才这么贵的。再问平时多少钱的时候，人家就不肯告诉我们了。,差评
实在没有什么景点，就只是爬爬山而以，花50元门票太不值了，还不如去天平山呢，人也少，就只有几个团体车，没什么人。,差评
留苏人员说可以免费预约，但是我们约了好几天都约不上，我以为只是个人原因，到了现场才知道，大部分人都没有约上，都要现场买票。这是典型的打政策擦边球！,差评
这什么鬼地方，山路都找不到的，门口么臭的要**，门票么80连个问路人也没的，走了大半天都没找到山路我也是无语了,差评
没啥人气、且门票价格太高了，如果开车进去竟然要收50元停车费，简直是坑爹，抢钱啊！,差评
"一塌糊涂，山不在高,有仙则名.，想去山上道观游玩，弄了半天爬上去还关闭了，骗人！早跟我说道观关闭了，十元我都不想去…",差评
穹窿山很大，上山累得半**，沿途标志太少。中途实在太累了，正好遇到上山的车，就坐车上山了。谁知到山上后想下来时，却下山的车少之又少，而且每一辆只能生一点点人。所以排队等车的人很多很多，我们等下一个多小时多沒等到。整个穹窿山也沒什么玩头，就山顶上有几座道观的房子，其他土祠堂、孙武苑等等，根本沒任何看头，真奇怪，这样的景区怎么会是5a级。,差评
停车场很小，没有位置停只能路边找车位，离门口很远。进去之前还各种码和查核酸我觉得很烦，里面也没啥好玩的，导游图完全看不懂，出来到了南门那个免费景区车牌子标识不清楚让人摸不着头脑，很多人不知道免费的景区车能不能去北门很多人都打算跟公交车了，都问公交车司机怎么坐车，反正就是感觉不好玩而且乱糟糟的，配不上五星,差评
风光不错，很值得去，但上真观里的三清观里面参观的时候道士会主动热情的带着你上二楼，抽签，解签，解完后拿出本子要你认捐香火和敬佛两项，还以道士以99为最，必须要几百99，非常过分，无奈只捐了2个99，多出的两块钱算是打赏的了。建议去玩的时候要注意避开。。,差评
昨天早上下了大雨湿淋淋的呆在站台等车本不想过去的后来还是挣扎了半天过去了但如同天气一样的大失所望说真的这是我玩过的景点中最差劲的一个整体非常糟糕只有一丁点的御道可以走走其他的一点都不好玩找景点找个半天而且昨天还没有浏览车全是走的建议有时间到其他地方玩,差评
什么乱七八糟的景点，一塌糊涂，这个价钱实在是太不值了，一点都没劲。,差评
我上午订好，高速路上堵车，怕耽误取消了，快到中午的时候，才来到。可是前一个订单退款，竟然说保险不给退。这个订单又收了一次保险，我想问同程，你们到是发个提醍给我啊，问客服就是一句不能退。你们这是有多坑爹。既然订单取消了，那对应的保险不是也应该无效吗？重复2次收取。以后再不用你们的app，连个提示都不给。钱不多，可是很伤人。,差评
穹窿山的前台服务人员态度之差，见所未见，闻所未闻，到底是国企，哎。。。,差评
感觉相当的坑，进去没什么玩的，坐个观光电瓶车就真的只是兜一圈，而且还挤得不得了，下山时坐电瓶车都没个管理的人，卫生情况也差,差评
在苏州这个地方来说，穹窿山算是好山了。山体延绵，郁郁葱葱。但开发得实在不行。路程中指示牌好少。我们下山时走的大路，最后居然是不通的，白走了不说，还得原路返回。也就是说上山下山只有一条路。门市价80的门票，感觉不值啊。,差评
真的只是去爬山，没有特别惊喜，从木渎地铁站出来等64路公交车花了近1个小时，车站环境很差，车上很挤，不值门票价,差评
这地方樱花没有，旅游景点一般，也没什么服务，就是卖了门票赚钱,差评
现场确认订单同程网络上不上去。最后只能现场买票。没有享受到优惠。下午4点多到家想取消订单，但显示是订单完成。现场支付了。我很奇怪。,差评
穹窿山再无真道士！有玉皇大帝的那个三清观千万别去，求签后解签被骗600元，现在看来道士都是假的，应该都是外面雇的！已经严重损害穹窿山，甚至道教形象！建议新闻夜班车去暗访取缔！,差评
同程网上购的票，进景区时正门不让过，让走侧门进。,差评
什么呀，室内全都不开放，但票价还是照收不误，可恶,差评
同程的用户体验还是非常好的，只是景区非常，非常不值这个票价，非常普通的小山丘，景色也没有什么特别之处。,差评
门票不值80怎么不去抢，一路上山完全无景点感。不如小县城的一座免费山头,差评
"孙武的茅草屋还可以,但是道观那边没什么景点,问路的时候被道士忽悠了二百块,人家讲的那水平,不给还不行的......总结:离道士远点",差评
同样一起买票，一张可以进，一张要两小时后入园，后来关照会员价的退了，买原价可以直接进！价格不同就区别对待，就是为了多賺钱，,差评
景区空气清新，绿意盎然，锻炼休闲是好地方.可是对于旅游内容贫乏，三清观里道士热情地引导游客被动认捐三百以上，更是让人有被挨宰算计的无奈.提醒游客们注意，不要进三清观参观！,差评
不值这个票价，景色特别一般，还没有天平山好，一路向上全是竹子别无其它，还要个大的寺庙,差评
花八十去哪里一点意义都没有除过山就是寺庙，本以为跟万鸟园通票结果需要另买票坑的一逼,差评
最高峰上不去，啥军事重地，这不坑人吗？门票根本不值这个价，就是被骗了！！怪不得人都没几个,差评
真心的太坑爹了，没有景色又没好看的。就看顶上的寺庙。靠,差评
现场没有售票人员，老年人特别不方便，信息化发达的同时，不能唯信息化而抛弃服务的本质,差评
一块钱看上去便宜。可是下载那个app后可以免费使用手机导游。你赚个推荐钱么，同程,差评
80元太贵了，就是爬山嘛，这个票价有点高。坑老百姓。,差评
感觉性价比不高，风景也不算非常美，皇帝估计专门来烧香的,差评
景区周边车位较少，不建议自驾前往哦,差评
这样的景不值这个票价，客官们慎入,差评
